,sentences
1360,"Using such merit-based processes as a means for salvation would be patently unfair, since some would have inherent advantages over others."
1361,Therefore only the smartest and deepest thinkers would be saved.
1362,God rejects such unfairness.
1363,"Instead, salvation is by faith only, and the message of salvation can be easily understood by anyone who is willing to listen and consider it."
1364,"God does not allow His plan for salvation to be proven, and therefore requires that it must be accepted only by faith."
1365,"The faith of the person, 113 which is belief, is apart from any work or merit."
1366,"Therefore humans can take no credit for any part of salvation, leaving all the credit to Jesus Christ the Savior."
1367,He did the work.
1368,He gets the credit and glory.
1369,And therefore salvation is a free gift from God.
1370,"Humans must first think that salvation is by faith in Jesus Christ the only Savior, and then must believe it to be saved."
1371,"Beliefs come from thoughts, so thoughts and thinking precede beliefs."
1372,"We think it, then we believe it or reject it."
1373,"Our life is about choices, for or against God, for or against truth."
1374,"Without that belief, everything else is simply muddling through life in a manner which ultimately has no meaning beyond death."
1375,"OK, that was intense."
1376,It is time to have some fun.
1377,Let's discuss dreaming.
1378,"Why is it so odd, and disconnected from the reality of our waking life?"
1379,"Glad you asked, because it is a very interesting and even fun subject."
1380,"And although dreaming is somewhat related to our thoughts and beliefs, there are some odd twists and turns."
1381,"Science cannot figure out the sleep and dreaming issue, although they have tried very hard to do so."
1382,"That is because science does not believe in a human soul, and dreaming occurs in the soul."
1383,"Therefore dreaming helps to further reveal the presence of a soul in humans, for those willing to see it."
1384,Some truly bizarre.
1385,"Memories may not be accurately recalled, even though we know the reality very well when awake."
1386,"Time may be distorted, with the dreamer at a previous point in their life, or in the future."
1387,We go from one place to another without transportation.
1388,Things and people randomly appear and disappear.
1389,"We do odd, hazardous, and bizarre things which we would never do in real life."
1390,"We try to perform tasks which are easy for us, but we cannot."
1391,Absurdities abound.
1392,We get caught in do-loops.
1393,The laws of physics are suspended.
1394,We hardly recognize the person who is posing as us in our own dreams.
1395,"Humans are not animals as we have discussed, but let us start with how animals dream, which is very different than humans."
1396,"Animals can have ""brain dreams"" because they have no soul, but only about instinctive activities such as running, climbing and other muscle memory activities."
1397,"But since humans have almost no instincts except for a few in newborns, we cannot 115 dream from the brain."
1398,"For humans, dreaming is a soul activity, even though it seems like the soul has missing pieces."
1399,"In fact, it does have missing pieces during sleep and dreaming."
1400,"Actually, parts of the soul go offline during sleep, but not the entire soul all at once."
1401,"The first conclusion we reach is, once again, dreaming is a soul activity, not a brain activity."
1402,It is artistic.
1403,"It is escapism, an escape from toil and repetitive boredom."
1404,"If that means dreaming is about doing something different, then that is an understatement."
1405,"Therefore dreaming results when individual soul components begin exerting some flexibility to operate without full supervision from ""The Boss."""
1406,"That ""Boss"" is the Heart of the soul, the primary component of the soul which shuts down during the majority of sleep."
1407,The Heart is the part of the soul which is in charge.
1408,It makes the decisions and sends out the orders.
1409,It is the controller of the soul.
1410,"But when it shuts down to rest and do maintenance actions, the various other parts of the soul have some vacation time."
1411,There is no one to tell them what to do.
1412,And sometimes more than one soul component goes offline at the same time.
1413,This is why REM sleep dreams can be so different than dreams just before we wake in the morning.
1414,Different parts of the soul are offline at different points of the sleep cycle.
1415,Now for some examples to explain the previous assertions.
1416,"At one point it will be the Memory, or at least portions of it."
1417,"Sometimes the short term Memory is down, then other times longer term Memory, and other times archival Memory is down."
1418,This is why our memories during dreaming can be so far off from reality.
1419,"Soul components go into a ""power saving"" mode during sleep, including Memory which does not function as well during sleep."
1420,"In our dreams we may remember that we are in a certain job, but that might have been years ago."
1421,"But that does not stop us from dreaming about being in that job at the present time, but it may be mixed with later memories, such as being married."
1422,Then people who are now dead appear.
1423,"Therefore during sleep we can be at many different times and locations which occurred during our life, or at no time or location we have ever experienced."
1424,"If the Mind does not supply accurate time and location data, the Memory will invent it."
1425,This makes for some very odd dreams about time and location.
1426,"But it is not the same as being truly unconscious, where waking is difficult or even impossible."
1427,"Being unconscious is not sleep, and dreaming while unconscious probably does not occur, or maybe rarely based on the level of unconsciousness, which are not all the same."
1428,"Those things which affect the brain affect soul awareness, including sleep."
1429,"As mentioned earlier, we know that animals can dream."
1430,"Well, sort of."
1431,But not as humans do.
1432,"Animals dream in repetitive motion and instinctive ways from their sensory center, which is in the brain, and mainly as muscle memory."
1433,"They run away from danger, or chase other animals."
1434,They dream instinctive actions.
1435,But human dreams are not based on instincts or repetitive motion.
1436,"If we bolt upright, we are awake when it occurs."
1437,"Because my soul does not know how to swing a golf club, so it cleverly avoids the subject."
1438,"The soul cannot swing a golf club, but the brain can."
1439,It is the same with any complex repetitive motion sport.
1440,"The dream may include having done the action, but it does not include doing the action, not in any detail, at least."
1441,It would not be the complex scenarios humans dream about which cannot happen in real life.
1442,And so that explains the public nudity thingy.
1443,But only men admit to it.
1444,Women seem to have issues about the subject.
1445,Trick question.
1446,"That definition is OK to define the concept that such things occur, but there is no separate subconscious mind."
1447,"But since the Mind is not always active during sleep, the other components must either wait or invent an outrageous set of bizarre circumstances to fill in the blanks."
1448,"This background processing in the Mind is what some would call a subconscious, but it is actually just background processing inside the Mind."
1449,"Although different than dreaming, a human soul can become disoriented to reality during waking time in much the same way as in dreaming."
1450,"The Heart can be subverted, corrupted, or may abdicate its responsibilities while awake."
1451,Other soul components may abdicate their responsibilities.
1452,The soul can become dysfunctional.
1453,We will discuss these issues next.
1454,"It is a terrible thing for the person involved, and also for those who care about that person."
1455,"This chapter will cover some of the issues related to mental illness and associated maladies, and why they occur."
1456,"However, this chapter will only try to deal with what the Bible says about the subject, and will not attempt to cover the issues in any detail, which would require another book."
1457,"Having said that, the books which have been written on the subject mainly approach the issues from the viewpoint of a dysfunctional brain, not as soul issues."
1458,"A well-known Pastor from the 1800's, C.H."
1459,"Spurgeon, said of this issue: ""The mind can descend far lower than the body, for in it there are bottomless pits."
1460,"The flesh can bear only a certain number of wounds and no more, but the soul can bleed in ten thousand ways, and die over and over again."""
1461,"The soul can become distorted and think and believe things which do not align with reality, as noted in previous chapters."
1462,Our purpose here is to discuss such issues in view of what the Bible reveals about distortions of the human soul.
1463,"While this may often be necessary and useful, it deals with shutting off the soul from the brain using chemical inhibitors."
1464,"While there are exceptions, it is usually the soul which becomes distorted, not the chemicals in the brain."
1465,So it is the soul which leads to most mental maladies.
1466,"There are various forms of mental distortions, maladies, and illnesses which can cause the person to be unable to control their own thought processes."
1467,"And that is the key, loss of control over the soul due to internal battles for control."
1468,"Some of these are present at a low level in most people, although generally occasional and controllable."
1469,"We will now cover this subject in greater detail, and later will discuss the solutions found in the Bible."
1470,And the Bible is the only source of true soul and spirit healing through rehabilitation of thought processes.
1471,"The soul seeks patterns of behavior, usually for repetitive actions and thinking processes to make life easier."
1472,"Instead of internal control by the Heart, an outside force seems to have taken control of the soul."
1473,"And to some degree, that is true."
1474,"That outside force is actually an inside force which is attached to the soul, and is what we have discussed previously as the Sinful Nature."
1475,"It was not given to us by God, but was acquired by the original sin in the Garden of Eden."
1476,"Therefore the Sinful Nature is the legacy of that original sin by our ancestors, passed down to all of us."
1477,"This is counter to psychology and psychiatry which seeks to resolve what they see as physical issues and chemical imbalances, since they do not generally believe there is a soul."
1478,"So even if the Mind becomes convinced, it will often be overruled."
1479,"Instead, the Sinful Nature has taken control of the soul and is aligned with the non-thinking part of the soul, the Emotion, to drive a feeling-based approach to life rather than a thinking and believing approach."
1480,"And God requires a thinking and believing approach to our spiritual life, not an emotional one."
1481,"For instance, schizophrenia and bipolar are a result of an internal battle for control of the soul, on one side by the Heart supported by a rational Mind, and on the other side by the Emotion aligned with the Sinful Nature."
1482,The person can alternate between what they logically understand and what they feel.
1483,"Reasoning with such a person can have a positive effect, but only until they allow the feeling side to take over again."
1484,"The feeling side has a strong arrogance factor due to the influences of the Sinful Nature, which is the source of this sin."
1485,"When the Sinful Nature and Emotion rule the soul, it will decline into a distorted state."
1486,"The by- product is arrogance in the soul, starting out slowly, but building over time."
1487,"This is what creates a manic-depressive state, 122 when the Emotion alternately controls the soul in a high state and then cannot maintain such control of the soul, resulting in a low state as the Emotion pulls back removing emotional involvement, while the Heart remains neutralized by the Sinful Nature."
1488,"Panic attacks can occur in between during the vacuum periods since there is no one in charge of the soul, so it literally cannot think or emote."
1489,Thinking and believing rationally becomes more and more difficult.
1490,"Such distortion begins with mild unreality and soul absurdities, but in later stages becomes illogical chaos."
1491,"The person may remain generally functional, or become mentally incapacitated, or something in between, but they are in a state of unreality to either a small or great extent."
1492,"Therefore the answer to why people can think in such a distorted manner is that when the Emotion is aligned with the Sinful Nature, and these two have created a pattern of over-ruling the Mind and Heart, it eventually becomes a set pattern of arrogance which the person may be unable to break, even if they desire to do so."
1493,"At the same time the Sinful Nature exerts greater control over the soul, creating chaos and non-linear thought processes guided by arrogance, meaning the inability to think clearly."
1494,"The Sinful Nature stages a coup against the Heart, becoming an evil dictator which rules as an illogical and arrogant tyrant, robbing the soul of any hope of peace or happiness."
1495,"Young people can get into this distorted soul cycle during their teen years, and it is important that it be stopped as soon as possible."
1496,"If it is not stopped at an early point, it will become much harder to do so later."
1497,"The resulting mental instability leads to locked-in arrogance which rejects many types of authority, and promotes other mental sins such as hatred, jealousy and envy which cause a severe narrowing of mental tolerance and a near total inability to accept any form of truth in the areas of Sinful Nature-Emotion dominance."
1498,"When this truth denial becomes non- selective it turns into a neurosis or psychosis, but most people do not reach that level of generalized truth rejection."
1499,"These mental sins can overwhelm the soul and cause a shutdown of the Heart, at least in certain areas of life."
1500,The person then lives on the lusts of the Sinful Nature.
1501,"These lusts are not always the carnal type, but rather power, monetary, superiority, and many other lusts which become possible."
1502,"Generally, the mixture of lusts and sins distort the world view."
1503,"Cosmic System devices such as self-delusion, self-absorption, transference, and denial reject the logical deliberations of the soul, and result in a soul which is out of control and unable to process information in a logical manner, except of course in narrow areas of mechanical skills and rote memory application to a job or hobby."
1504,"The mental sin combo of arrogance, envy, jealousy, and hatred rejects truth and authority other than one's own."
1505,"Such people live on lies as their basis for a world view, and truth is a casualty."
1506,"They rely on empty arguments, they utter lies; they conceive trouble and give birth to evil."
1507,"Whoever eats their eggs will die, and when one is broken, an adder is hatched."""
1508,"In this relationship the Emotion is the wild card, and can be a disrupter."
1509,"When the Sinful Nature interferes in soul processes, it first attacks the Emotion by enticing it into an illicit soul relationship, resulting in an upset of the delicate balance in the soul by causing the Emotion to become unhappy with what is going on."
1510,The issues do not need to be rational or reasonable.
1511,"It starts to think ""Hey, what am I -- a potted plant?"""
1512,"and at that point the Emotion, at the encouragement of the Sinful Nature, revolts against the authority of the Heart."
1513,"The Heart fights back and exerts its authority, and there is discordance in the soul."
1514,"That gratification can take the form of self-righteousness or hedonism or anything in between, or maybe both at the same time."
1515,An alternate reality is then created.
1516,"If this is not stopped, it is all downhill from there."
1517,It is at this point where the person begins to lose touch with reality.
1518,A deep sense of unhappiness ensues.
1519,The soul becomes hopelessly confused and depressed.
1520,The soul becomes less and less able to make sense of the reality around it.
1521,Concentration becomes more difficult.
1522,"The person feels a loss of control, but does not understand it."
1523,"At the same time, the standards of the Conscience eventually erode."
1524,"The soul sinks deeper and deeper into unhappiness and unreality, as the mental defense mechanisms fail."
1525,It is at this point that depression becomes the norm.
1526,"The soul can no longer function ""normally."""
1527,Chaos in the soul continues the slide into oblivion.
1528,"The best that can happen at this point is a lack of unhappiness, not happiness."
1529,For convenience we will generally just refer to them as mental distortions.
1530,"125 Everyone has these issues to some degree, so this is not unusual."
1531,"We can only see what is in the world, not what the Bible reveals."
1532,There is a war inside us over control of our thoughts.
1533,"Of course, it does not work that way."
1534,When the soul gets out of control as described above the result is chaos in the soul.
1535,That is soul damage.
1536,"And the damage is real, because the soul is real."
1537,It requires effort and a right approach.
1538,"Only information from the Bible can begin to repair the soul, if it can be accepted and internalized into the human spirit."
1539,Otherwise the mental drift will continue and will intensify.
1540,"The Word of God is alive and powerful, and can eventually overcome the Sinful Nature distortions of the soul and break its influence."
1541,"But it is hard, and takes time and persistence."
1542,Day by day.
1543,"And if medication helps calm the soul to allow study of the Word, then that is a good and proper use for them."
1544,"But the real solution is soul rehabilitation by getting the Heart and Mind back in control, putting the Emotion back into its rightful place, and suppression of the Sinful Nature."
1545,"By now you know the answer, which is that the Sinful Nature is the culprit."
1546,For those answers we must dig even deeper.
1547,"We have seen how the primary target of the Sinful Nature is the Emotion, which is a non- thinking part of the soul."
1548,"The Sinful Nature is an adversary to the Heart and Mind, constantly attempting to stage a coup against them."
1549,"It seeks control, and is not satisfied to stay in the background simply tempting to sin."
1550,"That is far too mundane a task, as far as it is concerned."
1551,"And this is where the true mischief lies, the desire of the Sinful Nature to usurp the Heart and Mind and take control of the soul."
1552,"But on the other hand, the soul's Emotion can take the side of the Sinful Nature and make bad decisions more difficult to avoid."
1553,But the Sinful Nature does not have the ability nor inclination to properly rule the soul.
1554,"It takes the Emotion hostage, a Stockholm Syndrome sets in, then they become allies."
1555,"Like any dictator, the Sinful Nature simply wants power."
1556,But in its ineptness it fails miserably.
1557,"Oddly it does not care, as long as it rules the soul, even if it harms its host, or destroys it."
1558,That is just how things go.
1559,"As Milton suggested in his book ""Paradise Lost"" some would rather rule in Hell than be a servant in Heaven, although that itself is an absurdity."
1560,But the Sinful Nature does not care about absurdity.
1561,"The Sinful Nature is a tyrant, a demagogue, a dictator, a ruthless taskmaster, and any other tyrannical word which can be mustered."
1562,Control is its goal.
1563,And it will stop at nothing to get it.
1564,A person may give in to it little by little.
1565,"Not all that much at first, but it is very patient."
1566,"Repeat the process and it gains more control, and more and more."
1567,"And the Sinful Nature learns as it matures, picking up lust patterns and areas of weakness to certain sins, some more than others."
1568,"""A little sleep, a little slumber, a little folding of the hands to rest, and poverty will come on you like a thief, and scarcity like an armed man."""
1569,And that can be true for believers as well as unbelievers.
1570,"Therefore the inputs which get through to the Heart are from the non-thinking sources, and the person's soul gets more and more out of control, and increasingly dysfunctional."
1571,"Depression, neurosis, psychosis and any of the forms of mental instability and self-destructive behavior become possible at that point."
1572,"Some people look at life from the viewpoint of the soul under the control of the Heart accepting the advice of the logical advisors inside the soul and the human spirit for the believer, and other people look at life from the viewpoint of the Heart under the control of the Sinful Nature backed by Emotion which are out of control, relegating the logical advisors of the soul to a position of low regard."
1573,"However, no believer can be demon possessed, only influenced by Satan's Cosmic System through the Sinful Nature."
1574,"All of this is because the Sinful Nature is part of Satan's realm, since he was the original source of it."
1575,"But we do not need to allow the Sinful Nature to gain control of our soul, and we also do not need the Sinful Nature to maintain control of our soul if it has already taken over."
1576,We will discuss solutions next.
1577,There is a knight in shining armor which can come to the rescue.
1578,However a solution is possible.
1579,"Discouragement would be the natural course at this point, but God always provides an opening for those who are hopeless."
1580,"There is a recovery process outlined in the Bible, and recovery is possible."
1581,"If the Sinful Nature is not resisted and controlled, it will become the dominant force in the life of a person, both unbelievers and believers."
1582,"The issue is not just sin, because no one is immune from it, and God forgives our transgressions."
1583,But rather it is about a coup in the soul whereby the Sinful Nature takes over the soul and replaces the Heart as the leader of the soul.
1584,"And the process for this takeover entails changing thoughts and beliefs to align with Cosmic System thinking, which the Sinful Nature uses to gain advantages and leverage in the soul."
1585,"So the key point here is that the Sinful Nature does not merely try to tempt us to sin, but more importantly it tempts us to reject the plan of God entirely, as well as reality and truth in general."
1586,"Whatever reality and truth support, the Sinful Nature seeks the opposite."
1587,"The longer this continues, the more hardened the soul becomes, and the more difficult recovery becomes."
1588,"When people have gone down the wrong road for a long time, a hard dose of reality is often required to get their attention."
1589,"It is one of the most effective ways to break the hold of the Sinful Nature, at least for a short while, and give the person an opportunity to change the course of their life."
1590,"Arrogance must be broken down, and emotionalism must be suppressed, so reality and truth can get through in the form of real thinking in the Heart."
1591,"If these opportunities are wasted, the likelihood of recovery grows dimmer."
1592,There is no other useful starting point for real solutions.
1593,"Those believers who have gone down the path of giving control of the soul over to the Sinful Nature must take the road to recovery by using the power from the Word of God, not by internal power."
1594,"Therefore the believer is required by God to resist the Sinful Nature and feed the human spirit with the Word of God which is ""alive and powerful"" in order to understand and implement the spiritual life after salvation."
1595,"This is a long and arduous process, and setbacks will abound."
1596,But it is the only long term solution.
1597,"It is a long process, not a quick fix."
1598,"Ephesians 10:6-18 says: ""Finally, be strong in the Lord and in his mighty power."
1599,"11 Put on the full armor of God, so that you can take your stand against the devil’s schemes."
1600,"16 In addition to all this, take up the shield of faith, with which you can extinguish all the flaming arrows of the evil one."
1601,"17 Take the helmet of salvation and the sword of the Spirit, which is the word of God."""
1602,"They will soar on wings like eagles; they will run and not grow weary, they will walk and not be faint.” The Bible is full of short and succinct verses which the believer can cling to during times of trouble, hardship, grief and distress."
1603,"The Sinful Nature resides in every human, as we have noted."
1604,"But beyond just sin, the Sinful Nature is also a distorting influence which negatively affects the ability to think clearly and logically."
1605,It is ultimately the source of all mental distortions.
1606,Therefore the key to avoiding mental distortions is control of the Sinful Nature.
1607,"It is a twisted and demented tyrant, and it must be resisted."
1608,"And that resistance comes from the human spirit filled with the Word of God, the source of spiritual strength for the believer."
1609,We cannot will our way to spiritual advance.
1610,Therefore the best way to resist mental distortions is to study and assimilate the Word of God from the time of salvation onward.
