,sentences
881,Then the Mind presents the best options to the Heart for a decision.
882,"The Heart requests inputs from others involved, especially the spouse."
883,The options are considered internally to the soul.
884,The spouse wants a black one.
885,An impasse occurs.
886,It is discovered the red one costs more.
887,The black one becomes more attractive to both.
888,The semi-final product is sent to the Heart.
889,Costs are reviewed again.
890,It is available at the local dealer.
891,The vehicle purchase is made.
892,"But which parts were the thoughts, thinking, and beliefs?"
893,This started a thinking process about buying a new vehicle.
894,This would become a serious issue due to its cost and long term commitment.
895,"There were numerous variables, some of them in conflict."
896,"Cost conflicted with desired options, so cost-benefit analyses needed to be performed."
897,New thoughts are introduced along the way.
898,"Maybe an electric car, hybrid, body styles, and other potential choices are considered."
899,"Thoughts and thinking go hand in hand, as one begets the other in a circular process."
900,"Thoughts are about specific issues, and thinking is the process of considering all the thoughts, which also forms new thoughts which might include interim conclusions on some of the issues."
901,One might be that the budget must not exceed a certain amount.
902,That becomes a belief which forms a parameter.
903,Parameters limit options and set boundaries.
904,Acceptance of that final thought by a decision turns it into a belief regarding what is best for the family.
905,So that is finally put to rest.
906,On to the next issue.
907,The two kids are nearing college age.
908,"And on it goes in the soul, which never gets a rest from thoughts, thinking, and decisions about what to believe."
909,"Granted, this is a description of how lower and mid-level beliefs are used when thoughts and thinking occur regarding an important, but not life altering, issue."
910,"80 Salvation belief is an example of a dramatic shift in core beliefs, and the most important one a person can make."
911,"If it is not immediately rejected, usually due to an existing and conflicting belief system, the Mind will begin a thinking process to determine if it should be accepted."
912,"That process can be rather short or occur over a long period of time, as the issue is thought about at certain times, maybe when someone close to them dies."
913,But there is a difference with the gospel.
914,"The Holy Spirit becomes involved and helps the unbeliever with the thought and thinking process by making the salvation message clear, bringing them to the point of belief, or no belief."
915,Thoughts and beliefs about many other issues may interfere.
916,"So the person must make a decision about salvation, whether to accept it (belief) or reject it outright, or by delay, saying ""I'll think about that later."""
917,And failure to make a decision is itself a decision.
918,"If salvation by faith in Christ is never accepted, then it is rejected by default, and the consequences are the same as an outright rejection."
919,"Not thoughts about Him, and not thinking about Him."
920,But rather belief in Him.
921,"Belief is acceptance, while thoughts and thinking can simply be musings about the issue with no real conclusion or acceptance."
922,Thoughts about salvation do not save a person.
923,Thinking about how Jesus Christ was a real person who did some good deeds long ago and was executed on a cross does not save a person.
924,"Only a belief, which is acceptance, that Jesus Christ is one's Savior, can be used by the Holy Spirit to lock in eternal salvation."
925,Thoughts and thinking about Jesus Christ must result in a decision to believe in Christ as Savior to make salvation a reality.
926,"It is the belief which saves, not the thoughts or thinking process."
927,It is our beliefs which matter.
928,"For every human who ever exists, this one decision about a single belief is the most important one they will make in life."
929,"It is a free gift from God, because He did all the work, and He offers it to all humans since we are helpless to save ourselves."
930,"But it must be accepted, meaning believed, since belief is acceptance."
931,"""Believe in the Lord Jesus Christ and you will be saved."""
932,"(Acts 16:31) ""For it is by grace you are saved through faith."""
933,"At the moment of belief the human spirit becomes regenerated, and that is the event which makes us a spiritual being and locks in our eternal salvation."
934,Forever.
935,We can see that salvation by faith alone is not as simple as it might seem.
936,He has made it the only way.
937,"Each person must make this decision, and that single belief or lack of belief will determine the eternal status of every human who ever lives."
938,"There are, of course, answers from the Bible."
939,"Some people do the complete opposite of what most would do when forming beliefs, and some will set aside portions of an overall belief system easily when it is convenient."
940,And some people say they believe one thing and do the opposite.
941,"So belief systems can be all over the map, and wildly different from one person to the next."
942,"Due to the ""irrationality factor"" involved, overall generalities will be explained, but belief systems cannot be forced into a mold."
943,"Everyone is different, and no two people have the exact same belief system."
944,"Therefore, having a core belief does not mean a person will comply with the entire belief system as outlined from top to bottom."
945,"Part of this is due to the various ways people arrive at their belief systems, which can often be random and undisciplined."
946,"Given the importance of beliefs aligning with reality, that would seem to be a bad idea."
947,And it is.
948,"Beliefs can either align with reality and truth, or try to defy them, or fall somewhere in between."
949,"Belief systems are best developed during childhood, and then re-tested after the person begins thinking as an adult."
950,"Parental teaching must now compete with more conflicting data, inputs, and information than ever before."
951,Therefore confusion among children has become intensified.
952,"And there is a right track, and there are wrong tracks, as defined by truth and reality vs. untruth and unreality."
953,"The world tries to deny this and restate the premise as there is no truth, so reality is what anyone thinks it is."
954,"A few examples would be useful, just for illustration to make a point."
955,Think of the ancient world where the earth was believed to be flat.
956,"Idolatry was also widespread, whereby most people worshiped statues make by human hands."
957,"Now idolatry is more sophisticated, but still based on falsehood."
958,"Many forms of magic and superstitions have been believed, and still are."
959,"There have been many forms of mysticism throughout history, which are generally beliefs in the powers of an outside force, but not from the true God."
960,"Numerous false religions have existed and still exist, with many followers."
961,"Alien abductions and crop circles, anyone?"
962,"Vampires, ghosts, zombies?"
963,"Of course, some of these are not actual beliefs but rather exaggerated stories, or fiction, even though untrue."
964,"Sometimes an untrue belief is just having fun or using the imagination, so as long as they do not become high level beliefs they have little effect."
965,"The fact is many beliefs held by people are patently untrue, and often bizarre."
966,"And this is the real problem, when untrue beliefs stand in the way of believing truth and facing reality when it is important."
967,Therefore some false beliefs can lead to a miserable life and even a miserable eternity.
968,"For instance, if someone believes chocolate ice cream is better than vanilla ice cream, then that is a matter of personal preference which does not generally affect others, either in a positive or negative way."
969,"One might think preferences among pickup trucks is also something irrelevant, but to some it is akin to a religious choice, so to them it is more than a choice among equally useful options."
970,"Showing preference of some product over another is still a belief, and it is that person's choice to make."
971,"However, the point is that a belief system is what the individual decides it should be, and the components are very personal, even if the belief system is foolish, detrimental, silly, ridiculous, shortsighted, or just plain wrong."
972,"There are many such beliefs out there, often based on low evidence inputs, hunches and intuition, and are therefore highly variable in quality."
973,But not all are important.
974,Sometimes a belief is just a way to set up a personal identity.
975,"After all, a person is defined by their beliefs."
976,"However, some beliefs matter a lot."
977,"This would be a failure of the core beliefs of such a believer, at least in that area."
978,"Such a belief would provide no motivation to seek to change the beliefs of the unbeliever, since it would apparently not matter."
979,Sometimes we just get less than we had expected.
980,Other times we avoid a core duty of being a believer.
981,"For the unbeliever, their belief system has eternal repercussions."
982,"If they are close to us, we want them to be happy and successful, and we may think they can achieve such things if they believe as we do."
983,"Or we may come into conflict with others, or be affected by their decisions, and we do not like what they believe because it is opposed to our beliefs."
984,"So if a person believes they deserve to have your property more than you do, and act on that belief, that brings about direct conflict and violates the right to own property."
985,Then we care about their beliefs.
986,"Christians want to affect the belief system of those who do not believe as they do, because they want all people to have eternal salvation and live a life which glorifies God."
987,"On the other hand, those who believe in 85 radical causes may want to suppress the rights of others who just want to live as they choose."
988,There are many reasons why the various belief systems in the world cause friction and disagreement.
989,"And that is the ultimate issue with belief systems, namely that it results in polarization."
990,Beliefs separate people.
991,They drive people apart.
992,"Jesus said ""Do not suppose that I have come to bring peace to the earth."
993,"I did not come to bring peace, but a sword."""
994,"Please do not misunderstand, polarization can be good or bad."
995,"Toleration is one thing, but actual acceptance joins with them in their beliefs."
996,"It will not be a surprise that if two people disagree about their core beliefs then there is a lack of harmony, and even friction between them, leading to polarization."
997,Core beliefs are very powerful things.
998,"And if the belief system is criminal, terroristic, and otherwise harmful to innocent people, it becomes necessary to isolate them, and the Bible supports that view."
999,An empty shell.
1000,Let us proceed to unravel that issue in more detail.
1001,"86 Core belief systems, the ones we really care about, can be very generally separated into two overall categories."
1002,"We could add a third which would be indifference about everything, but that is not much of a belief system, but rather the avoidance of beliefs."
1003,"Moral judgments would not be possible, and would be a joke."
1004,"Nothing would be out-of-bounds, criminal, or immoral."
1005,Nothing would be right or wrong.
1006,"In essence, there would be no principles to live by since they assume there is a difference between right and wrong, good and evil, compassion and intolerance."
1007,"Without God there would therefore be no principles of right and wrong, only self-benefit at any and all cost to others."
1008,"Others do not matter, only self matters."
1009,Eat or be eaten.
1010,Kill or be killed.
1011,"Those are ""principles"" of animals, and also humans who act like animals."
1012,"But wait, evolutionists believe humans are animals, so let us briefly examine what they would say about this issue."
1013,This is where evolutionists reveal their true self.
1014,"They are survivalists, and have no belief system apart from what an animal has, which is self-preservation."
1015,Interesting.
1016,"But alas, the evolutionists show they have no sense of anything moral or decent or good or of a higher purpose."
1017,That is illogical.
1018,"But the god ""Time"" overcomes logic."
1019,"And the 87 future will yield -- only more grinding up of the next set of species, including humans."
1020,"In this view people are animals, so they have no moral purpose in life except to be used to enhance future, stronger life-forms."
1021,But no other purpose.
1022,And an evil one.
1023,"The evolutionists do not believe in the soul, so killing off those ""human animals"" who are weaker is a moral imperative."
1024,"It is what their god ""Time"" demands as a sacrifice."
1025,A human sacrifice.
1026,"Which by contrast, brings us back to God and His beliefs."
1027,And His love.
1028,"God gives purpose to human life, and imparts high goals and moral achievements into the picture."
1029,"The point is that God is the source of belief systems which have meaning and purpose, morals and nobility of character, and good which opposes evil."
1030,"Apart from Him there would be only one belief system, which is not a belief, but rather the only available option -- survival."
1031,"But the Bible declares there is truth, and also that there is non-truth and/or lies, and that there is right and wrong."
1032,Note the emphasis on thinking.
1033,"""It"" is not all relative."
1034,"There is truth, and there are lies."
1035,"John 8:44 says ""You belong to your father, the devil, and you want to carry out your father’s desires."
1036,"He was a murderer from the beginning, not holding to the truth, for there is no truth in him."
1037,"When he lies, he speaks his native language, for he is a liar and the father of lies."""
1038,Pretty clear.
1039,And a mixture of partial truth and some lies is also a lie.
1040,"But unbelievers do not have access to absolute truth since it is only discerned by the human spirit using information from the Word of God, and they have neither a human spirit nor spiritual access to the Word."
1041,"Instead, God provided humans with an overall belief system as outlined in His Word."
1042,"As you might suspect, those beliefs which do not align with what God has provided in the Bible are said to be wrong, incorrect, and even evil."
1043,"It seems that God is fairly adamant about His set of norms and standards for humans, and that He has a belief system which humans must align with, rather than vice versa."
1044,"But as we look around we quickly find that beliefs among humans are quite variable, and often do not line up with what God has revealed."
1045,"In fact, humans try over and over to act as if God does not have the right to decide what is right and what is wrong."
1046,"which beliefs are correct vs. incorrect, then it is certainly God."
1047,"And He gets to decide for all people, including those who do not believe in Him."
1048,And it is love which ultimately separates God and His plan from a godless evolution- based belief system and its lack of any useful purpose.
1049,"And by the way, the only religion based on a loving God is Christianity."
1050,The only one.
1051,"But of course, it does not work that way."
1052,"This will not surprise you, but you want to know why it is true."
1053,"Only the Bible reveals that to us, so we will now drill down even further and explore and describe what the Bible says about variations in human thoughts and beliefs."
1054,"Having recently discussed the Sinful Nature, you likely already suspect it is somehow involved."
1055,You are correct.
1056,"At the core of the issue of variable belief systems is the internal battle in the soul, which pulls people in two directions and affects their thoughts, thinking, and beliefs."
1057,"It is this internal battle between the soul components, those which God created, and the 89 acquired Sinful Nature which humans created, which causes such large variations in belief systems among humans."
1058,"And this is a key point, that the most important issue which affects how core beliefs are formed and maintained is about the level of influence the Sinful Nature exerts on the soul, and the degree to which the Emotion is allied with that Sinful Nature."
1059,"When irrational and illogical beliefs are the overall theme in a person's life, there is a powerful influence from the Sinful Nature strongly allied with the Emotion influencing that person."
1060,"That is because two non-rational actors got together and tried to come up with a rational thought and belief, but failed miserably."
1061,"It cannot be overstated how much the Sinful Nature/Emotion alliance negatively affects the thoughts, thinking, and beliefs of humans."
1062,"Of course, we are not discussing an occasional odd belief, since there are many reasons for those."
1063,"A person gets into such a condition by making wrong decisions, one after another."
1064,"Rejection of God and His Word is a primary cause, but not the only one."
1065,People who reject God must approach life using their Heart and Mind to understand what God has designed into the universe as proper thinking and beliefs based on what seems to work out well.
1066,There is a cause-and-effect system built into God's design.
1067,"This usually starts out rather slowly, but builds into a hardened soul over time if it is not controlled."
1068,"Emotion must only come in after these primary soul players have first built a basis of understanding and wisdom, which leads to loving God."
1069,"At that point the Emotion can fulfill its true role to appreciate, rather than lead the soul and react."
1070,"After all, reality is obvious, is it not?"
1071,"The answer is that people who allow their Sinful Nature to take control of their Emotion on a regular basis will have a soul where the Heart is not in control, and therefore the Mind is suppressed from logical thinking."
1072,That means logic and rational thought is overcome by emotional feelings linked with beliefs based on premises which do not align with the truth and reality God has put in place.
1073,"This is why people can be so diametrically opposed in thinking, why they cannot see what you see so clearly, why people think in ways which do not appear to be real thoughts, and why there is such a political and social divide separating people from each other."
1074,"These are baffling to most people, and for good reason."
1075,Such thoughts and actions do not make sense.
1076,They are illogical and irrational.
1077,"A rational person would want to align themselves with reality and truth, which are ultimately from God."
1078,"But the seeds of revolt against God from the Sinful Nature assures that many people will reject the truth, whether it is the truth about God or the truth about social or political issues."
1079,"It is the Sinful Nature/Emotion alliance which makes feeling one's way through life into a belief system based not on thoughts, but on instincts, hunches, intuition, and other non-thinking approaches."
1080,"This alliance is not logical, it is reactive."
1081,"Of course, this is not an all-or-nothing issue, but rather a matter of degree."
1082,"For some it will be a little, and for others a lot more."
1083,"So this is the reason polarization is so rampant, because so many people have ceased thinking their way through life, and have substituted feeling their way along in a random manner, avoiding reality as they go."
1084,It is the story of human existence.
1085,Many wars have been fought over beliefs.
1086,The belief systems of dictators have squashed individual liberty 91 around the world.
1087,"The Sinful Nature causes serious distortions in thinking since it is not logical, but rather it is instinctive and deviant."
1088,"And recall that God did not give humans instincts to live by, but humans chose to add base instincts when they sinned."
1089,"The more a person gives in to these base instincts, the more illogical and deviant the thinking becomes."
1090,"And even animalistic, as we have seen."
1091,"It seeks to control the entire soul, and tries to distort or block belief in the truth."
1092,"Some people control it better than others, but all are subject to its influence."
1093,"Where there is illogical thought, the Sinful Nature is doing its work unhindered by the truth."
1094,"And when power is added to the equation, the corruption of thought is greatly enhanced."
1095,"Now that we have examined the basics of variability of beliefs, we will continue to explain what the Bible reveals about what happens to the soul when truth is rejected, how humans deal with the unreality they create in their belief systems, why polarization of beliefs is so harmful to societies and nations, and other related subjects."
1096,"We will also explore issues such as dreaming, dementia and Alzheimer's."
1097,"Much more to discuss about thoughts, thinking, and beliefs."
1098,"Next, we explore what most of the people around us actually believe."
1099,"However, there are surprisingly few."
1100,"And most primary belief systems center around self, family, religion, and causes."
1101,"The majority of people who have ever lived have utilized a very basic set of core beliefs, and do not think much about higher level issues."
1102,"In other words, the answer to the question which has been posed regarding what most humans believe is: ""the basics."""
1103,"Therefore most people who ever live will have done so under a system of beliefs focused on living a simple life at a rather low level of thinking and expectations, and therefore apart from God and His plan."
1104,"And it is not simply a matter of education levels, but rather is more about motivation to understand what life is about, and mainly comes down to a religion for most."
1105,"So when we refer to people engaging in higher order thoughts and beliefs it does not refer to the outcomes, but rather to the complexity of the thinking and believing processes involved."
1106,"Therefore the mental processes can be complex correct ones, or they can be complex yet flawed, or even complex and evil."
1107,It just means they are more complex.
1108,We will expand on this shortly.
1109,"The belief systems with the strongest influence over those who hold them center on religion, institutions, family, and self."
1110,"If a person becomes a Christian, that is a higher order belief system."
1111,"There are also higher order belief systems based on supporting causes which a person believes in deeply, whether focused on children or animals or the environment or whatever."
1112,"Those seeking power often have political belief systems, which are also complex."
1113,"Again, that does not imply good or bad, just complex."
1114,Thoughts and beliefs are powerful things because they result in an intensified form of motivation.
1115,"Now that we have that overview in mind, let us now take a look at the various forms of beliefs systems starting with the most basic and working up to the higher level ones."
1116,This belief system is an approach to life which has shown to enable survival and provide at least some level of stability and basic happiness.
1117,"Due to the curse put on the earth after the fall of humans in the Garden of Eden, humans are required to work hard and fight the cursed earth for survival."
1118,"The earth became unfriendly in many ways, and earning a living to care for family took most of one's efforts."
1119,"The remaining time was often spent doing chores and caring for family, plus trying to relax and avoid physical or mental exertion."
1120,The next work day will come around soon.
1121,"It is survival level living, thinking, and believing, which works well enough for most people."
1122,This is the level where most people live.
1123,"However, if someone takes this approach but also becomes a Christian or pursues another religion, the mixture of the simple life with complex beliefs about religion puts them into the higher order level of beliefs."
1124,Religion is a complex belief system.
1125,One might ask why people do not strive to think more complex thoughts and have higher order beliefs.
1126,"Life is a daily grind to feed, clothe, and shelter their family, with little time or funds remaining."
1127,"This daily grind uses most of the time, energy, and resources they have available, with very little left over."
1128,Others are just content to have basic beliefs to avoid complexity in the life.
1129,"Many reject religious beliefs, or are merely a joiner but not a practitioner."
1130,"19 Moreover, when God gives someone wealth and possessions, and the ability to enjoy them, to accept their lot and be happy in their toil—this is a gift of God."
1131,"20 They seldom reflect on the days of their life, because God keeps them occupied with gladness of heart."""
1132,"Having a family, work, the essentials of life, and being a good citizen can enable them to lead a rather normal and contented life."
1133,But then eternity is a different matter.
1134,"Some people prefer living at a basic level where they think in basic and repeatable ways, and purposely avoid dealing with complexity."
1135,Complex thoughts and beliefs require more complex coping systems to overcome the issues they bring with them.
