,sentences
0,"This book, in whole or in part, must not be used for any commercial purpose."
1,Free sharing of this book in its entirety is authorized.
2,10 BRAIN vs. That much is clear.
3,"But we want to truly understand our inner self, and why we humans are the way we are."
4,"They are difficult ones, to be sure, and this book is not a casual treatment of this subject, so you can expect real answers to these questions."
5,"For starters, if you believe thoughts and beliefs occur mainly in the brain, you are about to be very surprised."
6,"Humans have long sought answers to deep questions regarding their thoughts and beliefs, since these are about the inner core of human life."
7,We cannot simply look inside ourselves since that would be using self to try to explain self.
8,"And looking to psychology and science will fall far short since most science denies the existence of a soul, and therefore can only deal with the physical interfaces of the body."
9,"There is no better source of truth on the subject of the human soul than the Bible, because God designed this immaterial part of humans, and only He could explain it."
10,"So to understand this subject, we must look to the Designer for answers."
11,This book will challenge the Reader's thinking and question some of your core beliefs about the workings of the inner human.
12,"Otherwise, why would you want to read it?"
13,Mostly enormous failures.
14,"And it is not just about ourselves, but also those around us, those who have preceded us, and those who will come along in the future."
15,"It explains what the Bible says about the inner human, and will do so without apology."
16,"This is an important distinction because we are defining what a true human actually is, which is the immaterial part."
17,"Most cells of the body are constantly being replaced, therefore much of what was formerly our body died and was replaced long ago."
18,No.
19,"The material will someday cease to function entirely, but the same immaterial inner self will live on forever."
20,"The material physical body interfaces with the immaterial real human, but the two exist on different levels."
21,"When it comes to the structure of the material side of humans, science has discovered many things which have improved our health and enhanced our lives."
22,And we are grateful.
23,But science has failed miserably when it comes to the immaterial part of humans because it cannot reach the true inner human which is outside the material realm.
24,"Science calls this ""the hard question,"" because it has no answer regarding why humans can think and form beliefs."
25,"And He has revealed to us a lot more than most people realize, as we will discuss in detail."
26,It would also waste your time since it is mostly wrong.
27,"In other words, science is baffled by the inner human, and cannot understand it at any higher level beyond the material or animal levels."
28,"So they simply call it ""the hard question"" and move on."
29,"When science starts with a false premise, such as denying the existence of the human soul, there can be no basis for deep knowledge about the subject."
30,"But that does not apply to the inner human, which is beyond its reach and understanding."
31,"It is simply an accurate representation of what science has told us, that it does not understand much at all about human thinking and beliefs."
32,"Therefore we look to the Bible for answers, where they have been provided."
33,"The human body is therefore a material mechanism created by God which enables the inner immaterial human to interface with the material universe He created, with other humans, and with Him."
34,"The immaterial human needs a body to support it, both on earth and during eternity, although the eternal one will be much different."
35,"The human body is formed by DNA passed down from our ancestors, but each soul is created directly and uniquely by God."
36,"So we must quickly get beyond viewing the body, including the brain, as the true human when we attempt to understand the immaterial part of humans."
37,"For those who firmly believe the physical body is the actual human, this book is not for them."
38,"They believe that when this mortal body dies, that is the end, and nothing exists beyond the material."
39,"They believe humans are just another animal, although possibly a bit more advanced."
40,This book will not attempt to refute such a basic unbelief system.
41,"For those who have such beliefs, it would be 8 wise to continue reading and use the immaterial soul to think about the eternal future beyond death."
42,We will all live eternally either way.
43,But there are two very different ways of living eternally.
44,One is wonderful and the other is not.
45,"As a preview, the brain is NOT the center of human thought and belief."
46,Therefore it is not the true human.
47,"9 CHAPTER 2 BRAIN vs. We have been taught that the brain is the center of human thought, and therefore the center of humanity."
48,"Human science attempts to convince that the brain is the center of human life and the source of humanity, because it cannot find the soul."
49,"However, the Bible clearly describes the immaterial human soul as the true human, the location of thoughts and beliefs, and the center of our humanity."
50,"Please do not misunderstand, the brain is a wonderful organ designed by God, and incredible in its function."
51,"It is generally an artificial intelligence supercomputer with sensory connectors to the five main senses, plus a central controller for the physical body."
52,However the brain is overrated by those who attempt to attribute the higher level soul functions to it.
53,"This misguided approach is based mainly on the premise that if the soul cannot be discovered in a physical way, then it must not exist."
54,"What, therefore, is the role of the brain?"
55,"But its primary function as related to the inner human is to feed the soul with sensory data brought in by the five main senses which are sight, hearing, taste, touch, and smell."
56,"Therefore the brain relieves the soul from thinking about how to perform countless menial tasks, and frees the soul to engage in more meaningful endeavors, and truly live, not just survive."
57,"In this regard, the brain has been delegated certain tasks to perform apart from direct soul involvement."
58,"Meanwhile the soul can focus on higher order living which makes life more enjoyable, and provides the ability to interface with God."
59,Therefore our higher order memories are located in the soul.
60,"It performs emergency actions apart from direct soul involvement based on real-time sensory data due to the constraints of time, including emergency ""fight or flight"" actions."
61,"As such, the brain plays a primary role in the basic survival of the person."
62,"As mentioned, the brain is delegated sensory based tasks and memory associated with the five senses."
63,"Sensory information is funneled from each of the senses through the brain, where the brain acts as a sensory gateway between the body's senses and the soul."
64,One sense supports another.
65,"It makes our surroundings familiar, so we can focus on specific tasks and interests at higher levels."
66,"The primary mechanism of sensory memory is pattern matching, whereby the memory of a previous experience by our senses matches what we sense later, and a match is made, whether exact or similar in some way."
67,"It is how we recognize people, grass, and sky, why we know certain foods when we taste them, or know a car or lawn mower when we hear them, or a breeze when we feel it on our face."
68,"It is the brain which makes the match, then the soul deals with higher level understanding associated with what was sensed."
69,"Additionally, many human actions in life are repetitive ones which use muscle memory information stored in the brain, and these occur apart from direct involvement of the soul."
70,"After the soul decides what will be done, the brain executes most of the task, allowing the soul to focus on the experience itself."
71,"Muscle memory and sensory memory are functions of the brain, so they are actually brain memory, or brain programming."
72,"They are stored in and performed by the brain instead of the soul, unless 12 the soul decides to get involved."
73,The difference is a matter of low order task accomplishment vs. higher order living as a human.
74,"Think about the intricacies involved in walking and running, a golf or tennis swing, ice skating, bicycle riding, basketball shooting, baseball and football throwing, and so on which are based on muscle memory stored in the brain and only supported from the soul."
75,"Brain damage can interfere with soul outputs and inputs, but such damage does not change the soul, or eliminate what was already contained in it."
76,"Therefore a person with memory diseases such as Alzheimer's or dementia cannot get what is in the soul out through the brain, meaning the core person and their memories are not lost or even changed."
77,"The soul can be closed off to some degree by the body, but that does not destroy what was already in the soul."
78,This will be discussed in more detail later.
79,We recognize them from the brain.
80,"Think about driving down a road, and all the potential sensory inputs as the scenery goes whizzing by us."
81,"All that sensory data would quickly overwhelm the soul if it were just dumped as raw, unfiltered data into the soul."
82,"The soul functions at a high level, so most sensory data must be sorted and filtered in the brain before being turned over to the soul."
83,"During this process, which turns raw data into information, most of the raw data is disregarded as irrelevant."
84,Some of that higher order information becomes the source of thoughts and thinking.
85,"And these occur in the soul, not in the brain."
86,Sometimes the brain and soul get in each other's way.
87,"That happens when the brain muscle memory knows how to perform a task, but the soul decides to try to ""help."""
88,"For instance, Olympic level ice skaters can routinely perform flawlessly in practice, but under the intense pressure of competition the soul starts thinking about consequences, about winning and losing, whether something will disappoint family and friends, what the news will say about 14 any failures, and other higher order thoughts, but not necessarily helpful ones."
89,The soul may even make suggestions in the middle of a complex task.
90,"A discordance occurs, and the brain cannot concentrate."
91,We have all been there.
92,"Not necessarily ice skating, but many things in life go like that."
93,"The point is that if the entire task were done from muscle memory out of the brain, without soul interference, then all the practice would result in a much better outcome."
94,"But we have two parts, brain and soul, which can become involved when the stakes are raised."
95,And this is why people who play sports at a high level must perform from their brain with a quiet soul.
96,Not always easy to do.
97,"The soul can be very insistent, and that is when pressure is felt, and the consequences of failure are considered."
98,"Sights, smells, tastes, things touched, and sounds which were experienced and are now in memory as brain patterns can be used for matching."
99,"The connections between the material and immaterial are mostly on the immaterial side, meaning it is the human soul which provides the primary interfaces with the material brain."
100,"There are no material ""dangling wires"" in the brain which lead to an unseen soul."
101,"When the electrical signals are gone, it shows the soul is gone, even if the physical body continues to function otherwise to some degree."
102,Thoughts and beliefs go way beyond the senses and interaction with the universe and muscle memory.
103,"Our thoughts and beliefs occur inside the human soul, which is the inner human, the image of God, which He designed to enable humans to have thoughts and beliefs as He does, and therefore to be capable of understanding and interacting with Him, and also loving Him."
104,"And only a soul can truly love, and have thoughts and beliefs related to love."
105,Therefore we can understand why the human brain is not the true human.
106,"It performs the lower order functions for the person, and does not survive beyond death."
107,"Therefore the brain is not the source of thought, beliefs, emotion, conscience or storage for higher level human memory."
108,True love does not come from the brain.
109,Trusting God does not occur in the brain.
110,"This makes the brain the physical intermediary, not the true human."
111,"But first, let us take a short side-trip to examine how and why humans are different than animals."
112,16 CHAPTER 3 HUMANS vs.
113,"ANIMALS God created both humans and animals, and He designed them to be very different types of creatures."
114,"He created humans to live eternally, and animals to live only temporally."
115,"Because of that, animals have no soul, and do not think in the human sense of the word, nor do they hold beliefs."
116,"This is why humans are not animals, since animals have nothing immaterial about them."
117,"Humans have a greatly enhanced artificial intelligence supercomputer brain, but we also have an immaterial soul connected to it which makes us very different than animals, and also makes us eternal."
118,"But since animals have no soul, God gave them something unique which He did not give to humans, as we will see."
119,"The real life of a human is in the soul, although the human material body can be viewed as physically alive."
120,But the life of an animal is entirely in the body.
121,"Most people think of human superiority over animals as a given, but that superiority does not come from the physical brain, but rather from the soul of humans."
122,"Humans could not be at the top of the animal kingdom without a soul, because the material part of humans is actually inferior to many animals."
123,"It is our thinking which makes us superior, not our physical attributes, and that thinking is only in the soul."
124,"Humans are virtually devoid of enhanced instincts, and have only a few basic ones to enable newborns to get started in life."
125,"17 However, evolutionary theories assume that humans are animals without souls, and put humans at the top of the evolutionary chain."
126,"Without those higher order capabilities, humans as animals would have become extinct quickly in a body not designed for animalistic living in a wild world."
127,"Rather, God made humans far more capable than animals, more capable than any brain could ever become, by putting a soul inside."
128,Therefore the suppositions concerning thought and belief in humans are not the same as for animals.
129,"Beyond that, we hold beliefs, and can believe in God and learn to love Him."
130,"We think about the future, and the past."
131,"But the real missing link is that no animal has a soul, and evolution could never make a leap from no soul to a soul, from purely material to material plus immaterial."
132,"Therefore, creatures without souls could never evolve into souled creatures."
133,To go from no soul to a soul is not an evolutionary step.
134,Humans think and believe from an immaterial soul.
135,Animals cannot since they have none.
136,"Therefore the real missing link of evolution, the wall of impenetrability between animals and humans, is the soul which yields thoughts and beliefs."
137,"This is why the evolutionist must believe that humans are animals with no soul, because the human soul creates an impassable barrier between animal and human, one which evolutionary theory cannot accommodate."
138,The material cannot evolve into the immaterial.
139,Even evolutionists believe this.
140,"And if anyone wonders how they can still believe what they believe, that is a later chapter in this book."
141,No animal comes anywhere near the global dominance humans have exerted on the earth.
142,There is no way they ever could.
143,Maybe a pat on the head or such.
144,That is about all.
145,"No higher order thinking there, just instincts."
146,But advanced animals do have the five senses in common with humans.
147,"But the endpoint for that sensory information is the brain of animals, rather than the soul in humans."
148,"They can figure out how to defeat a squirrel-proof bird feeder, but that is simply trial and error."
149,"For the sake of illustration only, if a human body could function with the soul removed, the result would be, at best, a dysfunctional animal."
150,"That is because the higher order thoughts and beliefs would be gone without a soul, and since the human brain has almost no instincts, it would have a significant disadvantage for survival."
151,"So if a human body could ""live"" without a soul, it would not function like what we expect from a human."
152,"In fact, it would never have consciousness."
153,This can and does happen.
154,"The physical part of humans was not designed to have the brain function as a capable animal apart from the soul, which is much different than how animals are designed."
155,"God did not create humans as animals, and He does not want the physical human body to be capable of acting as an animal if a soul is not present."
156,"Such creatures would be robots or androids, not humans."
157,"Humans have almost no instincts, except for newborns in order to get them started in life -- nursing, swallowing, and a few others."
158,"But enhanced instincts are programmed into almost all animals, from large mammals down to tiny insects, to enable them to survive."
159,It is the instincts which make up for their lack of a soul.
160,Baby turtles run toward the ocean at birth.
161,"Mosquitoes find us no matter how we try to avoid them, and they have a ""brain"" the size of a pinhead."
162,"We can see instinctive behaviors in most animals around us, and many other instincts are less obvious."
163,"But God did not give humans such instincts because He gave us a soul and requires us to think our way through life, not act on instincts to merely survive."
164,"For humans, God wants more from us than mere survival, He wants us to know Him, understand Him, and maybe even learn to love Him."
165,"For animals God wants them to do what He programmed them to do, and support humans on many levels."
166,"Instincts take the place of a soul in animals, but it is not thinking or even cognitive, and it is not immaterial."
167,"It is programming in their brains, often very tiny ones."
168,"We see something that looks like affection and appreciation from them, but it is not based on thinking."
169,There is a stimulus and they provide a response.
170,"Or maybe they ignore it, if they are a cat."
171,"They remember a previous stimulus, and they might even respond in anticipation well in advance."
172,"Some actions are complex, to be sure."
173,"Fascinating, but simply supercomputer calculations plus a lot of trial and error repetition."
174,"They just want to eat and will work tirelessly to achieve this basic instinctive goal, even when the ground is covered with acorns."
175,But they do not have a soul.
176,"Animals do not have the ability to think in the abstract, or think at all in our use of the term."
177,"They want to remain alive due to instincts, but they do not know they are alive."
178,"Humans can think the abstract thought ""I am alive"" and know the profound implications."
179,Animals cannot think at all in the way we view the issue.
180,Humans do not simply think better than animals.
181,"We think, and they do not."
182,"We have beliefs, and they do not."
183,They have advanced instincts and we do not.
184,The difference is the soul.
185,The only source of thought and beliefs.
186,"20 It is the human soul which can believe in God, and can learn to love Him."
187,No animal has ever believed in God.
188,And God created animals because of humans.
189,They were put on earth to support humans in numerous ways.
190,God would not use an evolutionary process to create humans.
191,"God gave humans a soul, but not animals because He has different purposes for each."
192,"Sorry, no soul."
193,"But there will be new types of animals in eternity because we will live on a New Earth with new plant life as described in the Bible, so there will likely be new forms of animal life as well."
194,"Just not your former pet because the physics and environment will be very different, not based on atoms and molecules and such."
195,"But before we leave this issue, which includes instincts, we have discussed that God did not create humans with much in the way of instincts."
196,"The Sinful Nature is animalistic, because at its core it is instinctive in a negative sense, not in a positive sense."
197,"It makes humans capable of anger, hatred, lusts and violence, and therefore it is animalistic."
198,"Not what God intended for humans, but because of sin we have it."
199,"Some people give in to it, while others control it to a greater or lesser degree."
200,But it affects all humans.
201,More on these issues later.
202,"Now that we understand the humans vs. animals issue, we see the absurdity of evolution theories, and also appreciate what God did when He created animals with their unique enhanced instincts."
203,"Now we will proceed during the next several chapters to dive even deeper into the intricacies of the human soul in ways few have ever explored, let alone understood."
204,"As the source of thoughts and beliefs, the soul expresses the essential traits of being human, namely, we think, we make decisions about important life issues, we form beliefs, and we know we exist, all in our immaterial inner human."
205,"But because humans have a soul, we can think high level thoughts and have beliefs in that soul, centered on knowing these things matter to self, to others, and to God."
206,Forever.
207,Nothing remaining.
208,"Without the soul, nothing about our existence would matter since it would only be very temporary."
209,"God certainly would not be part of such an absurdity, which is why He gave us a soul which will live forever."
210,Therefore our life matters.
211,The soul gives life meaning and purpose.
212,"Humans are required by God to use our soul to make decisions and choices, ultimately for or against Him."
213,And only a self-aware being can ask why they exist.
214,which is answered only by the Bible.
215,We are here to make decisions for or against God.
216,"And the choices we make determine future outcomes, both during our lifetime and forever."
217,"One of those decisions might be about what we eat for lunch, and another about our relationship with God."
218,"One has eternal implications, and the other does not."
219,And those decisions are not from a brain in the body.
220,The soul is humanity and forever.
221,"All beliefs are formed in the inner human, and belief is what God requires of 22 humans if they are to have eternal salvation."
222,"That alone makes beliefs the most important issue in life, because it determines our eternal status."
223,"Newborns do not enter the world with thoughts, beliefs or self-awareness."
224,"The newborn's soul must learn and recognize that there is such a thing as the world outside of itself, then learn about it and how it operates."
225,"Those which the newborn will later recognize as ""people"" show up regularly and then the baby eats, which satisfies a basic need."
226,Massive amounts of sensory data is experienced.
227,Language is heard repetitively.
228,"Basic thoughts begin to be formed in the soul, usually about food, discomfort, and other needs."
229,"And on it goes as the soul is developed into something which can think, and eventually form beliefs about the world around it."
230,"Therefore the human soul develops first by taking in empirical sensory data as the senses identify the sights, sounds, smells, tastes and touch sensations we encounter, categorize them, and try to match them with sensory memories in the brain."
231,"At first memories are mainly sensory, but eventually thoughts and beliefs develop life memories."
232,"And we know it was us who experienced all those things, not someone else, so we know we exist."
233,We are self-aware.
234,"Sorry, but that is backward."
235,"That is because humans are not born thinking, even though they exist, so the concept ""I think, therefore I exist"" works only after many years of empirical sensory learning."
236,"Newborns exist, but do not think."
237,"The ability to think must be learned, because at birth the soul is blank and empty, and therefore cannot have thoughts or be self-aware."
238,"Empirical sensory information must be taken into the soul first by the five senses, then through the brain, and then into the soul where the foundation for thinking is formed over time."
239,"All of this makes empiricism, which Descartes was trying to avoid, the foundational basis of rationalism and deductive reasoning."
240,There is also a difference between the immaterial parts of believers and unbelievers.
241,"This involves the human spirit, which is separate and distinct from the soul."
242,"We define ""believers"" as those who have believed in Jesus Christ as their Savior, and we define ""unbelievers"" as those who have never believed in Jesus Christ as their Savior."
243,That one specific belief separates those who are on the side of God from those who are not.
244,"There are believers and there are unbelievers, a clear separation among humans."
245,The immaterial part of humans is amazing.
246,This is where beliefs come into play.
247,Beliefs are often strongly held and will determine what conclusions will be drawn.
